{
  "bundles": {
    "base-0.6b": {
      "aliases": [
        "base",
        "clone",
        "wavekat-base-0.6b"
      ],
      "artifacts": [
        {
          "component": null,
          "path": "config.json",
          "quality": null,
          "role": "config",
          "sha256": "9f6444a4e6c6a2bb238116957f2852713c447a581f791dcea088e6e6bf9bb55c",
          "size": 1462,
          "url": "https://huggingface.co/wavekat/Qwen3-TTS-0.6B-Base-ONNX/resolve/177cd39e2ddab0d4d7ce5152a7abc2d382621158/config.json?download=true"
        },
        {
          "component": "cp_codec_embedding_0",
          "path": "embeddings/cp_codec_embedding_0.npy",
          "quality": null,
          "role": "embedding",
          "sha256": "2cf4b5d6f6fca977657bc82634eea275cd072036a6a16484febd41b5445abff1",
          "size": 8388736,
          "url": "https://huggingface.co/wavekat/Qwen3-TTS-0.6B-Base-ONNX/resolve/177cd39e2ddab0d4d7ce5152a7abc2d382621158/embeddings/cp_codec_embedding_0.npy?download=true"
        },
        {
          "component": "cp_codec_embedding_1",
          "path": "embeddings/cp_codec_embedding_1.npy",
          "quality": null,
          "role": "embedding",
          "sha256": "c8655ecd642f17d04a85ea37c2665205a8666843925227b25dc8c8bceb8015f5",
          "size": 8388736,
          "url": "https://huggingface.co/wavekat/Qwen3-TTS-0.6B-Base-ONNX/resolve/177cd39e2ddab0d4d7ce5152a7abc2d382621158/embeddings/cp_codec_embedding_1.npy?download=true"
        },
        {
          "component": "cp_codec_embedding_10",
          "path": "embeddings/cp_codec_embedding_10.npy",
          "quality": null,
          "role": "embedding",
          "sha256": "bf17275629b464a4a38826beeb79b99e0e58cc02c530da2e572b9b7d9972fb2d",
          "size": 8388736,
          "url": "https://huggingface.co/wavekat/Qwen3-TTS-0.6B-Base-ONNX/resolve/177cd39e2ddab0d4d7ce5152a7abc2d382621158/embeddings/cp_codec_embedding_10.npy?download=true"
        },
        {
          "component": "cp_codec_embedding_11",
          "path": "embeddings/cp_codec_embedding_11.npy",
          "quality": null,
          "role": "embedding",
          "sha256": "dee4af40f34626a4951fba2b894120c8cf8293024ae068d1f2579f356c6e2284",
          "size": 8388736,
          "url": "https://huggingface.co/wavekat/Qwen3-TTS-0.6B-Base-ONNX/resolve/177cd39e2ddab0d4d7ce5152a7abc2d382621158/embeddings/cp_codec_embedding_11.npy?download=true"
        },
        {
          "component": "cp_codec_embedding_12",
          "path": "embeddings/cp_codec_embedding_12.npy",
          "quality": null,
          "role": "embedding",
          "sha256": "e307b70fbaddc6e7e48259b4e8c9417f24b155be9281205f38bbf40c64359951",
          "size": 8388736,
          "url": "https://huggingface.co/wavekat/Qwen3-TTS-0.6B-Base-ONNX/resolve/177cd39e2ddab0d4d7ce5152a7abc2d382621158/embeddings/cp_codec_embedding_12.npy?download=true"
        },
        {
          "component": "cp_codec_embedding_13",
          "path": "embeddings/cp_codec_embedding_13.npy",
          "quality": null,
          "role": "embedding",
          "sha256": "cc15bfc4290be77523f8f14c78b9b1710042b5d078291ee87038dfb7ecb3f185",
          "size": 8388736,
          "url": "https://huggingface.co/wavekat/Qwen3-TTS-0.6B-Base-ONNX/resolve/177cd39e2ddab0d4d7ce5152a7abc2d382621158/embeddings/cp_codec_embedding_13.npy?download=true"
        },
        {
          "component": "cp_codec_embedding_14",
          "path": "embeddings/cp_codec_embedding_14.npy",
          "quality": null,
          "role": "embedding",
          "sha256": "aa0de98365775e1cb968514595ff7e23936bea21c2bda6e5bab7e7052cdf97ba",
          "size": 8388736,
          "url": "https://huggingface.co/wavekat/Qwen3-TTS-0.6B-Base-ONNX/resolve/177cd39e2ddab0d4d7ce5152a7abc2d382621158/embeddings/cp_codec_embedding_14.npy?download=true"
        },
        {
          "component": "cp_codec_embedding_2",
          "path": "embeddings/cp_codec_embedding_2.npy",
          "quality": null,
          "role": "embedding",
          "sha256": "5436624853b3091bc1b88cf37a4d60af46346c508237d72e597bed561a5b2138",
          "size": 8388736,
          "url": "https://huggingface.co/wavekat/Qwen3-TTS-0.6B-Base-ONNX/resolve/177cd39e2ddab0d4d7ce5152a7abc2d382621158/embeddings/cp_codec_embedding_2.npy?download=true"
        },
        {
          "component": "cp_codec_embedding_3",
          "path": "embeddings/cp_codec_embedding_3.npy",
          "quality": null,
          "role": "embedding",
          "sha256": "1041b78ea5158c96cda4aae45bd21707a6fe8c92e6831715075d70d7b5b8e77a",
          "size": 8388736,
          "url": "https://huggingface.co/wavekat/Qwen3-TTS-0.6B-Base-ONNX/resolve/177cd39e2ddab0d4d7ce5152a7abc2d382621158/embeddings/cp_codec_embedding_3.npy?download=true"
        },
        {
          "component": "cp_codec_embedding_4",
          "path": "embeddings/cp_codec_embedding_4.npy",
          "quality": null,
          "role": "embedding",
          "sha256": "17af8770454ab26ca82f092d0d5a634680e4d14412d327fb8b6f94a57b256800",
          "size": 8388736,
          "url": "https://huggingface.co/wavekat/Qwen3-TTS-0.6B-Base-ONNX/resolve/177cd39e2ddab0d4d7ce5152a7abc2d382621158/embeddings/cp_codec_embedding_4.npy?download=true"
        },
        {
          "component": "cp_codec_embedding_5",
          "path": "embeddings/cp_codec_embedding_5.npy",
          "quality": null,
          "role": "embedding",
          "sha256": "b9abbf163b50ba0207e2196772c67b2e1025cf7f4fbe378c6a44123869253ad9",
          "size": 8388736,
          "url": "https://huggingface.co/wavekat/Qwen3-TTS-0.6B-Base-ONNX/resolve/177cd39e2ddab0d4d7ce5152a7abc2d382621158/embeddings/cp_codec_embedding_5.npy?download=true"
        },
        {
          "component": "cp_codec_embedding_6",
          "path": "embeddings/cp_codec_embedding_6.npy",
          "quality": null,
          "role": "embedding",
          "sha256": "1fb06414cb7d4edcd73142e79cbb4bd46f918517e5812b73345ade9535c6eafb",
          "size": 8388736,
          "url": "https://huggingface.co/wavekat/Qwen3-TTS-0.6B-Base-ONNX/resolve/177cd39e2ddab0d4d7ce5152a7abc2d382621158/embeddings/cp_codec_embedding_6.npy?download=true"
        },
        {
          "component": "cp_codec_embedding_7",
          "path": "embeddings/cp_codec_embedding_7.npy",
          "quality": null,
          "role": "embedding",
          "sha256": "08b8d7bd125d75ffa42f515153e66ade42cb16c2eea6ebe1935a2ac2509cbad0",
          "size": 8388736,
          "url": "https://huggingface.co/wavekat/Qwen3-TTS-0.6B-Base-ONNX/resolve/177cd39e2ddab0d4d7ce5152a7abc2d382621158/embeddings/cp_codec_embedding_7.npy?download=true"
        },
        {
          "component": "cp_codec_embedding_8",
          "path": "embeddings/cp_codec_embedding_8.npy",
          "quality": null,
          "role": "embedding",
          "sha256": "a2cf331bb3e2f2c0d44c91c55af045b9c975199331e4566a373b883ce04e9964",
          "size": 8388736,
          "url": "https://huggingface.co/wavekat/Qwen3-TTS-0.6B-Base-ONNX/resolve/177cd39e2ddab0d4d7ce5152a7abc2d382621158/embeddings/cp_codec_embedding_8.npy?download=true"
        },
        {
          "component": "cp_codec_embedding_9",
          "path": "embeddings/cp_codec_embedding_9.npy",
          "quality": null,
          "role": "embedding",
          "sha256": "389422edef8c0b6dbf6cdb48359a0274b11984c04668c004810866784dab2942",
          "size": 8388736,
          "url": "https://huggingface.co/wavekat/Qwen3-TTS-0.6B-Base-ONNX/resolve/177cd39e2ddab0d4d7ce5152a7abc2d382621158/embeddings/cp_codec_embedding_9.npy?download=true"
        },
        {
          "component": "talker_codec_embedding",
          "path": "embeddings/talker_codec_embedding.npy",
          "quality": null,
          "role": "embedding",
          "sha256": "47fa9e30f98b1528fc9b332d314f22a32fa33e187509a4d3537f8b2c31199e39",
          "size": 12583040,
          "url": "https://huggingface.co/wavekat/Qwen3-TTS-0.6B-Base-ONNX/resolve/177cd39e2ddab0d4d7ce5152a7abc2d382621158/embeddings/talker_codec_embedding.npy?download=true"
        },
        {
          "component": "text_embedding",
          "path": "embeddings/text_embedding.npy",
          "quality": null,
          "role": "embedding",
          "sha256": "e49a5ebb22075609520b91db99c33cf7590cefddc96d574a725a353ff0b1f480",
          "size": 1244659840,
          "url": "https://huggingface.co/wavekat/Qwen3-TTS-0.6B-Base-ONNX/resolve/177cd39e2ddab0d4d7ce5152a7abc2d382621158/embeddings/text_embedding.npy?download=true"
        },
        {
          "component": "text_projection_fc1_bias",
          "path": "embeddings/text_projection_fc1_bias.npy",
          "quality": null,
          "role": "embedding",
          "sha256": "2ca292516e9574fa67e0174a49770051156246bb0679096f0514286091eea7c3",
          "size": 8320,
          "url": "https://huggingface.co/wavekat/Qwen3-TTS-0.6B-Base-ONNX/resolve/177cd39e2ddab0d4d7ce5152a7abc2d382621158/embeddings/text_projection_fc1_bias.npy?download=true"
        },
        {
          "component": "text_projection_fc1_weight",
          "path": "embeddings/text_projection_fc1_weight.npy",
          "quality": null,
          "role": "embedding",
          "sha256": "94b62d00b306c5db843ac86dc135354889a2ce40d7adce79ae23f63c3d6acf19",
          "size": 16777344,
          "url": "https://huggingface.co/wavekat/Qwen3-TTS-0.6B-Base-ONNX/resolve/177cd39e2ddab0d4d7ce5152a7abc2d382621158/embeddings/text_projection_fc1_weight.npy?download=true"
        },
        {
          "component": "text_projection_fc2_bias",
          "path": "embeddings/text_projection_fc2_bias.npy",
          "quality": null,
          "role": "embedding",
          "sha256": "0725b7f7d0318f430723177d046eaf3b08c7a65d4a4a6dd264d61e574e66ff19",
          "size": 4224,